{
  "$schema": "https://json-schema.org/draft/2020-12/schema",
  "$id": "https://ricotaarcade.local/schema/popularidad/1",
  "title": "CTR-07 — Popularidad por tema, medida en YouTube",
  "description": "Una medicion con fecha, no un hecho. Cada numero declara de que video y de que dia es. Una plataforma por archivo: no se suma ni se promedia con ninguna otra (RES-52 f). Lo escribe scripts/ingerir-popularidad.mjs; no se edita a mano.",
  "type": "object",
  "additionalProperties": false,
  "required": ["contrato", "contratoVersion", "fuente", "actualizado", "vigenciaDias", "temas"],
  "properties": {
    "contrato": { "const": "CTR-07" },
    "contratoVersion": { "const": 1 },
    "fuente": {
      "const": "youtube",
      "comment": "Const y no enum: un archivo, una plataforma. Si vuelve el dato de Spotify (hoy cerrado, RES-51) es otro contrato y otro ranking."
    },
    "actualizado": { "type": "string", "pattern": "^\\d{4}-\\d{2}-\\d{2}$" },
    "vigenciaDias": {
      "type": "integer",
      "minimum": 1,
      "maximum": 365,
      "comment": "Plazo que se dan las mediciones antes de considerarse vencidas (Developer Policies III.E.4). Lo fija BR-18 (d) en 180: descarto 30 por incumplible en un proyecto de rafagas y 365 por ser el piso de falla ya señalado."
    },
    "nota": { "type": "string", "maxLength": 400 },
    "temas": {
      "type": "array",
      "minItems": 1,
      "items": { "$ref": "#/$defs/entrada" }
    }
  },
  "$defs": {
    "entrada": {
      "type": "object",
      "additionalProperties": false,
      "required": ["slug", "disco", "estado"],
      "properties": {
        "slug": { "type": "string", "pattern": "^[a-z0-9]+(-[a-z0-9]+)*$", "maxLength": 90 },
        "disco": {
          "enum": [
            "gulp", "oktubre", "un-baion-para-el-ojo-idiota", "bang-bang-estas-liquidado",
            "la-mosca-y-la-sopa", "lobo-suelto", "cordero-atado", "luzbelito",
            "ultimo-bondi-a-finisterre", "momo-sampler"
          ]
        },
        "estado": { "enum": ["medido", "sin-medir", "sin-video", "retirado"] },
        "video": { "$ref": "#/$defs/video" },
        "medicion": { "$ref": "#/$defs/medicion" },
        "motivo": { "type": "string", "minLength": 10, "maxLength": 300 }
      },
      "allOf": [
        {
          "comment": "medido = hay video y hay numero con fecha. Es el corazon del contrato.",
          "if": { "required": ["estado"], "properties": { "estado": { "const": "medido" } } },
          "then": { "required": ["video", "medicion"] }
        },
        {
          "comment": "sin-medir = el id esta resuelto y el numero no se pudo tomar. Se conserva el id y se dice por que.",
          "if": { "required": ["estado"], "properties": { "estado": { "const": "sin-medir" } } },
          "then": { "required": ["video", "motivo"], "not": { "required": ["medicion"] } }
        },
        {
          "comment": "sin-video = se busco y no hay video declarable. Sin motivo no se distingue de 'nadie lo cargo todavia'.",
          "if": { "required": ["estado"], "properties": { "estado": { "const": "sin-video" } } },
          "then": {
            "required": ["motivo"],
            "allOf": [
              { "not": { "required": ["video"] } },
              { "not": { "required": ["medicion"] } }
            ]
          }
        },
        {
          "comment": "retirado = fuera de circulacion. No conserva numero: el refresco no lo toca y una cifra que no se refresca se pudre en el archivo.",
          "if": { "required": ["estado"], "properties": { "estado": { "const": "retirado" } } },
          "then": { "required": ["motivo"], "not": { "required": ["medicion"] } }
        }
      ]
    },
    "video": {
      "type": "object",
      "additionalProperties": false,
      "required": ["id", "canal", "canalId", "canalNombre", "titulo", "resolucion", "resuelto"],
      "properties": {
        "id": {
          "type": "string",
          "pattern": "^[A-Za-z0-9_-]{11}$",
          "comment": "Supuesto declarado (CTR-07.3): esta para que no entre una URL pegada, no para verificar el id."
        },
        "canal": { "enum": ["topic", "banda", "otro"] },
        "canalId": { "type": "string", "pattern": "^UC[A-Za-z0-9_-]{22}$" },
        "canalNombre": { "type": "string", "minLength": 2, "maxLength": 120 },
        "titulo": { "type": "string", "minLength": 1, "maxLength": 200 },
        "duracionSeg": { "type": "integer", "minimum": 1, "maximum": 7200 },
        "resolucion": {
          "enum": ["listado-de-canal", "busqueda", "manual"],
          "comment": "Por que via entro este id. Sirve para re-auditar un lote entero si una de las tres resulta poco confiable (CTR-07.4)."
        },
        "resuelto": { "type": "string", "pattern": "^\\d{4}-\\d{2}-\\d{2}$" },
        "justificacion": { "type": "string", "minLength": 20, "maxLength": 300 }
      },
      "allOf": [
        {
          "comment": "Fuera del canal Topic hay que decir por que este video y no otro (RES-52 b).",
          "if": { "required": ["canal"], "properties": { "canal": { "enum": ["banda", "otro"] } } },
          "then": { "required": ["justificacion"] }
        }
      ]
    },
    "medicion": {
      "type": "object",
      "additionalProperties": false,
      "required": ["vistas", "medido"],
      "comment": "Los dos campos son obligatorios: no existe una cifra sin su fecha.",
      "properties": {
        "vistas": {
          "type": "integer",
          "minimum": 0,
          "comment": "Entero. La API devuelve viewCount como string; lo parsea el script, no el consumidor."
        },
        "medido": { "type": "string", "pattern": "^\\d{4}-\\d{2}-\\d{2}$" }
      }
    }
  }
}
