{
  "contrato": "CTR-07",
  "contratoVersion": 1,
  "fuente": "youtube",
  "actualizado": "2026-08-24",
  "vigenciaDias": 180,
  "temas": [
    {
      "slug": "barbazul-versus-el-amor-letal",
      "disco": "gulp",
      "estado": "sin-video",
      "motivo": "Todavia nadie corrio la fase de resolucion: no hay videoId declarado."
    },
    {
      "slug": "la-bestia-pop",
      "disco": "gulp",
      "estado": "sin-video",
      "motivo": "Todavia nadie corrio la fase de resolucion: no hay videoId declarado."
    },
    {
      "slug": "roto-y-mal-parado",
      "disco": "gulp",
      "estado": "sin-video",
      "motivo": "Todavia nadie corrio la fase de resolucion: no hay videoId declarado."
    },
    {
      "slug": "pierre-el-vitricida",
      "disco": "gulp",
      "estado": "sin-video",
      "motivo": "Todavia nadie corrio la fase de resolucion: no hay videoId declarado."
    },
    {
      "slug": "unos-pocos-peligros-sensatos",
      "disco": "gulp",
      "estado": "sin-video",
      "motivo": "Todavia nadie corrio la fase de resolucion: no hay videoId declarado."
    },
    {
      "slug": "yo-no-me-cai-del-cielo",
      "disco": "gulp",
      "estado": "sin-video",
      "motivo": "Todavia nadie corrio la fase de resolucion: no hay videoId declarado."
    },
    {
      "slug": "te-voy-a-atornillar",
      "disco": "gulp",
      "estado": "sin-video",
      "motivo": "Todavia nadie corrio la fase de resolucion: no hay videoId declarado."
    },
    {
      "slug": "superlogico",
      "disco": "gulp",
      "estado": "sin-video",
      "motivo": "Todavia nadie corrio la fase de resolucion: no hay videoId declarado."
    },
    {
      "slug": "nam-fri-frufi-fali-fru",
      "disco": "gulp",
      "estado": "sin-video",
      "motivo": "Todavia nadie corrio la fase de resolucion: no hay videoId declarado."
    },
    {
      "slug": "el-infierno-esta-encantador-esta-noche",
      "disco": "gulp",
      "estado": "sin-video",
      "motivo": "Todavia nadie corrio la fase de resolucion: no hay videoId declarado."
    },
    {
      "slug": "criminal-mambo",
      "disco": "gulp",
      "estado": "sin-video",
      "motivo": "Todavia nadie corrio la fase de resolucion: no hay videoId declarado."
    },
    {
      "slug": "pianito-jam",
      "disco": "gulp",
      "estado": "sin-video",
      "motivo": "Todavia nadie corrio la fase de resolucion: no hay videoId declarado."
    },
    {
      "slug": "fuegos-de-octubre",
      "disco": "oktubre",
      "estado": "sin-video",
      "motivo": "Todavia nadie corrio la fase de resolucion: no hay videoId declarado."
    },
    {
      "slug": "preso-en-mi-ciudad",
      "disco": "oktubre",
      "estado": "sin-video",
      "motivo": "Todavia nadie corrio la fase de resolucion: no hay videoId declarado."
    },
    {
      "slug": "musica-para-pastillas",
      "disco": "oktubre",
      "estado": "sin-video",
      "motivo": "Todavia nadie corrio la fase de resolucion: no hay videoId declarado."
    },
    {
      "slug": "semen-up",
      "disco": "oktubre",
      "estado": "sin-video",
      "motivo": "Todavia nadie corrio la fase de resolucion: no hay videoId declarado."
    },
    {
      "slug": "divina-tv-fuhrer",
      "disco": "oktubre",
      "estado": "sin-video",
      "motivo": "Todavia nadie corrio la fase de resolucion: no hay videoId declarado."
    },
    {
      "slug": "motor-psico",
      "disco": "oktubre",
      "estado": "sin-video",
      "motivo": "Todavia nadie corrio la fase de resolucion: no hay videoId declarado."
    },
    {
      "slug": "jijiji",
      "disco": "oktubre",
      "estado": "sin-video",
      "motivo": "Todavia nadie corrio la fase de resolucion: no hay videoId declarado."
    },
    {
      "slug": "cancion-para-naufragios",
      "disco": "oktubre",
      "estado": "sin-video",
      "motivo": "Todavia nadie corrio la fase de resolucion: no hay videoId declarado."
    },
    {
      "slug": "ya-nadie-va-a-escuchar-tu-remera",
      "disco": "oktubre",
      "estado": "sin-video",
      "motivo": "Todavia nadie corrio la fase de resolucion: no hay videoId declarado."
    },
    {
      "slug": "masacre-en-el-puticlub",
      "disco": "un-baion-para-el-ojo-idiota",
      "estado": "sin-video",
      "motivo": "Todavia nadie corrio la fase de resolucion: no hay videoId declarado."
    },
    {
      "slug": "noticias-de-ayer",
      "disco": "un-baion-para-el-ojo-idiota",
      "estado": "sin-video",
      "motivo": "Todavia nadie corrio la fase de resolucion: no hay videoId declarado."
    },
    {
      "slug": "aquella-solitaria-vaca-cubana",
      "disco": "un-baion-para-el-ojo-idiota",
      "estado": "sin-video",
      "motivo": "Todavia nadie corrio la fase de resolucion: no hay videoId declarado."
    },
    {
      "slug": "todo-preso-es-politico",
      "disco": "un-baion-para-el-ojo-idiota",
      "estado": "sin-video",
      "motivo": "Todavia nadie corrio la fase de resolucion: no hay videoId declarado."
    },
    {
      "slug": "vencedores-vencidos",
      "disco": "un-baion-para-el-ojo-idiota",
      "estado": "sin-video",
      "motivo": "Todavia nadie corrio la fase de resolucion: no hay videoId declarado."
    },
    {
      "slug": "vamos-las-bandas",
      "disco": "un-baion-para-el-ojo-idiota",
      "estado": "sin-video",
      "motivo": "Todavia nadie corrio la fase de resolucion: no hay videoId declarado."
    },
    {
      "slug": "ella-debe-estar-tan-linda",
      "disco": "un-baion-para-el-ojo-idiota",
      "estado": "sin-video",
      "motivo": "Todavia nadie corrio la fase de resolucion: no hay videoId declarado."
    },
    {
      "slug": "todo-un-palo",
      "disco": "un-baion-para-el-ojo-idiota",
      "estado": "sin-video",
      "motivo": "Todavia nadie corrio la fase de resolucion: no hay videoId declarado."
    },
    {
      "slug": "heroe-del-whisky",
      "disco": "bang-bang-estas-liquidado",
      "estado": "sin-video",
      "motivo": "Todavia nadie corrio la fase de resolucion: no hay videoId declarado."
    },
    {
      "slug": "rock-para-los-dientes",
      "disco": "bang-bang-estas-liquidado",
      "estado": "sin-video",
      "motivo": "Todavia nadie corrio la fase de resolucion: no hay videoId declarado."
    },
    {
      "slug": "la-parabellum-del-buen-psicopata",
      "disco": "bang-bang-estas-liquidado",
      "estado": "sin-video",
      "motivo": "Todavia nadie corrio la fase de resolucion: no hay videoId declarado."
    },
    {
      "slug": "un-pacman-en-el-savoy",
      "disco": "bang-bang-estas-liquidado",
      "estado": "sin-video",
      "motivo": "Todavia nadie corrio la fase de resolucion: no hay videoId declarado."
    },
    {
      "slug": "nadie-es-perfecto",
      "disco": "bang-bang-estas-liquidado",
      "estado": "sin-video",
      "motivo": "Todavia nadie corrio la fase de resolucion: no hay videoId declarado."
    },
    {
      "slug": "esa-estrella-era-mi-lujo",
      "disco": "bang-bang-estas-liquidado",
      "estado": "sin-video",
      "motivo": "Todavia nadie corrio la fase de resolucion: no hay videoId declarado."
    },
    {
      "slug": "maldicion-va-a-ser-un-dia-hermoso",
      "disco": "bang-bang-estas-liquidado",
      "estado": "sin-video",
      "motivo": "Todavia nadie corrio la fase de resolucion: no hay videoId declarado."
    },
    {
      "slug": "ropa-sucia",
      "disco": "bang-bang-estas-liquidado",
      "estado": "sin-video",
      "motivo": "Todavia nadie corrio la fase de resolucion: no hay videoId declarado."
    },
    {
      "slug": "nuestro-amo-juega-al-esclavo",
      "disco": "bang-bang-estas-liquidado",
      "estado": "sin-video",
      "motivo": "Todavia nadie corrio la fase de resolucion: no hay videoId declarado."
    },
    {
      "slug": "toxi-taxi",
      "disco": "la-mosca-y-la-sopa",
      "estado": "sin-video",
      "motivo": "Todavia nadie corrio la fase de resolucion: no hay videoId declarado."
    },
    {
      "slug": "fusilados-por-la-cruz-roja",
      "disco": "la-mosca-y-la-sopa",
      "estado": "sin-video",
      "motivo": "Todavia nadie corrio la fase de resolucion: no hay videoId declarado."
    },
    {
      "slug": "un-poco-de-amor-frances",
      "disco": "la-mosca-y-la-sopa",
      "estado": "sin-video",
      "motivo": "Todavia nadie corrio la fase de resolucion: no hay videoId declarado."
    },
    {
      "slug": "mi-perro-dinamita",
      "disco": "la-mosca-y-la-sopa",
      "estado": "sin-video",
      "motivo": "Todavia nadie corrio la fase de resolucion: no hay videoId declarado."
    },
    {
      "slug": "blues-de-la-artilleria",
      "disco": "la-mosca-y-la-sopa",
      "estado": "sin-video",
      "motivo": "Todavia nadie corrio la fase de resolucion: no hay videoId declarado."
    },
    {
      "slug": "tarea-fina",
      "disco": "la-mosca-y-la-sopa",
      "estado": "sin-video",
      "motivo": "Todavia nadie corrio la fase de resolucion: no hay videoId declarado."
    },
    {
      "slug": "el-pibe-de-los-astilleros",
      "disco": "la-mosca-y-la-sopa",
      "estado": "sin-video",
      "motivo": "Todavia nadie corrio la fase de resolucion: no hay videoId declarado."
    },
    {
      "slug": "nueva-roma",
      "disco": "la-mosca-y-la-sopa",
      "estado": "sin-video",
      "motivo": "Todavia nadie corrio la fase de resolucion: no hay videoId declarado."
    },
    {
      "slug": "salando-las-heridas",
      "disco": "la-mosca-y-la-sopa",
      "estado": "sin-video",
      "motivo": "Todavia nadie corrio la fase de resolucion: no hay videoId declarado."
    },
    {
      "slug": "queso-ruso",
      "disco": "la-mosca-y-la-sopa",
      "estado": "sin-video",
      "motivo": "Todavia nadie corrio la fase de resolucion: no hay videoId declarado."
    },
    {
      "slug": "invocacion",
      "disco": "lobo-suelto",
      "estado": "sin-video",
      "motivo": "Todavia nadie corrio la fase de resolucion: no hay videoId declarado."